/home/other/johna/.local/lib/python3.10/site-packages/pandas/core/computation/expressions.py:21: UserWarning: Pandas requires version '2.8.4' or newer of 'numexpr' (version '2.8.1' currently installed).
  from pandas.core.computation.check import NUMEXPR_INSTALLED
/home/other/johna/.local/lib/python3.10/site-packages/pandas/core/arrays/masked.py:61: UserWarning: Pandas requires version '1.3.6' or newer of 'bottleneck' (version '1.3.2' currently installed).
  from pandas.core import (
/usr/lib/python3/dist-packages/scipy/__init__.py:146: UserWarning: A NumPy version >=1.17.3 and <1.25.0 is required for this version of SciPy (detected version 1.26.4
  warnings.warn(f"A NumPy version >={np_minversion} and <{np_maxversion}"
================================================================================
VAE v2.6.10 DATASET CREATION
================================================================================

Strategy: Combine real RGB (296 BH) + predicted RGB (229 BH)

Loading RGB prediction models...
✓ Models loaded

Loading v2.6.7 dataset (real RGB)...
✓ 238,506 samples from 296 boreholes

Loading raw datasets...
  GRA...
  MS...
  NGR...

Boreholes to add (GRA+MS+NGR, no RGB camera): 228

Creating dataset with predicted RGB...
Processing boreholes:   0%|          | 0/228 [00:00<?, ?it/s]Processing boreholes:   0%|          | 1/228 [00:00<02:27,  1.54it/s]Processing boreholes:   1%|          | 2/228 [00:05<12:28,  3.31s/it]Processing boreholes:   1%|▏         | 3/228 [00:07<09:04,  2.42s/it]Processing boreholes:   2%|▏         | 4/228 [00:08<07:40,  2.06s/it]Processing boreholes:   2%|▏         | 5/228 [00:09<06:13,  1.68s/it]Processing boreholes:   3%|▎         | 6/228 [00:10<04:45,  1.29s/it]Processing boreholes:   3%|▎         | 7/228 [00:10<03:56,  1.07s/it]Processing boreholes:   4%|▎         | 8/228 [00:12<04:29,  1.22s/it]Processing boreholes:   4%|▍         | 9/228 [00:14<04:57,  1.36s/it]Processing boreholes:   4%|▍         | 10/228 [00:15<05:03,  1.39s/it]Processing boreholes:   5%|▍         | 11/228 [00:18<06:34,  1.82s/it]Processing boreholes:   5%|▌         | 12/228 [00:18<05:13,  1.45s/it]Processing boreholes:   6%|▌         | 13/228 [00:21<06:31,  1.82s/it]Processing boreholes:   6%|▌         | 14/228 [00:22<05:14,  1.47s/it]Processing boreholes:   7%|▋         | 15/228 [00:23<04:48,  1.35s/it]Processing boreholes:   7%|▋         | 16/228 [00:24<04:52,  1.38s/it]Processing boreholes:   7%|▋         | 17/228 [00:26<04:54,  1.40s/it]Processing boreholes:   8%|▊         | 18/228 [00:27<04:51,  1.39s/it]Processing boreholes:   8%|▊         | 19/228 [00:28<04:47,  1.38s/it]Processing boreholes:   9%|▉         | 20/228 [00:30<04:43,  1.36s/it]Processing boreholes:   9%|▉         | 21/228 [00:31<04:53,  1.42s/it]Processing boreholes:  10%|▉         | 22/228 [00:33<05:00,  1.46s/it]Processing boreholes:  10%|█         | 23/228 [00:34<04:59,  1.46s/it]Processing boreholes:  11%|█         | 24/228 [00:36<05:40,  1.67s/it]Processing boreholes:  11%|█         | 25/228 [00:39<06:09,  1.82s/it]Processing boreholes:  11%|█▏        | 26/228 [00:41<06:28,  1.92s/it]Processing boreholes:  12%|█▏        | 27/228 [00:44<07:28,  2.23s/it]Processing boreholes:  12%|█▏        | 28/228 [00:47<08:11,  2.46s/it]Processing boreholes:  13%|█▎        | 29/228 [00:49<07:52,  2.37s/it]Processing boreholes:  13%|█▎        | 30/228 [00:50<06:58,  2.12s/it]Processing boreholes:  14%|█▎        | 31/228 [00:54<07:53,  2.40s/it]Processing boreholes:  14%|█▍        | 32/228 [00:56<07:28,  2.29s/it]Processing boreholes:  14%|█▍        | 33/228 [00:58<07:58,  2.46s/it]Processing boreholes:  15%|█▍        | 34/228 [01:02<08:36,  2.66s/it]Processing boreholes:  15%|█▌        | 35/228 [01:04<08:38,  2.68s/it]Processing boreholes:  16%|█▌        | 36/228 [01:07<08:52,  2.77s/it]Processing boreholes:  16%|█▌        | 37/228 [01:10<08:53,  2.79s/it]Processing boreholes:  17%|█▋        | 38/228 [01:11<06:52,  2.17s/it]Processing boreholes:  17%|█▋        | 39/228 [01:12<06:09,  1.96s/it]Processing boreholes:  18%|█▊        | 40/228 [01:14<05:51,  1.87s/it]Processing boreholes:  18%|█▊        | 41/228 [01:16<05:38,  1.81s/it]Processing boreholes:  18%|█▊        | 42/228 [01:19<07:08,  2.30s/it]Processing boreholes:  19%|█▉        | 43/228 [01:20<05:43,  1.86s/it]Processing boreholes:  19%|█▉        | 44/228 [01:21<04:36,  1.50s/it]Processing boreholes:  20%|█▉        | 45/228 [01:23<05:36,  1.84s/it]Processing boreholes:  20%|██        | 46/228 [01:27<07:33,  2.49s/it]Processing boreholes:  21%|██        | 47/228 [01:29<06:56,  2.30s/it]Processing boreholes:  21%|██        | 48/228 [01:30<05:36,  1.87s/it]Processing boreholes:  21%|██▏       | 49/228 [01:31<04:36,  1.54s/it]Processing boreholes:  22%|██▏       | 50/228 [01:32<04:09,  1.40s/it]Processing boreholes:  22%|██▏       | 51/228 [01:33<04:23,  1.49s/it]Processing boreholes:  23%|██▎       | 52/228 [01:35<04:40,  1.59s/it]Processing boreholes:  23%|██▎       | 53/228 [01:36<03:45,  1.29s/it]Processing boreholes:  24%|██▎       | 54/228 [01:40<06:34,  2.27s/it]Processing boreholes:  24%|██▍       | 55/228 [01:45<08:40,  3.01s/it]Processing boreholes:  25%|██▍       | 56/228 [01:46<06:30,  2.27s/it]Processing boreholes:  25%|██▌       | 57/228 [01:48<06:20,  2.22s/it]Processing boreholes:  25%|██▌       | 58/228 [01:48<04:52,  1.72s/it]Processing boreholes:  26%|██▌       | 59/228 [01:50<04:32,  1.61s/it]Processing boreholes:  26%|██▋       | 60/228 [01:51<04:19,  1.55s/it]Processing boreholes:  27%|██▋       | 61/228 [01:52<04:09,  1.49s/it]Processing boreholes:  27%|██▋       | 62/228 [01:54<04:13,  1.52s/it]Processing boreholes:  28%|██▊       | 63/228 [01:56<04:14,  1.54s/it]Processing boreholes:  28%|██▊       | 64/228 [01:57<03:50,  1.40s/it]Processing boreholes:  29%|██▊       | 65/228 [01:58<03:45,  1.38s/it]Processing boreholes:  29%|██▉       | 66/228 [01:59<03:29,  1.29s/it]Processing boreholes:  29%|██▉       | 67/228 [02:00<03:10,  1.18s/it]Processing boreholes:  30%|██▉       | 68/228 [02:01<02:56,  1.10s/it]Processing boreholes:  30%|███       | 69/228 [02:02<02:43,  1.03s/it]Processing boreholes:  31%|███       | 70/228 [02:02<02:22,  1.11it/s]Processing boreholes:  31%|███       | 71/228 [02:03<02:19,  1.13it/s]Processing boreholes:  32%|███▏      | 72/228 [02:04<02:06,  1.23it/s]Processing boreholes:  32%|███▏      | 73/228 [02:05<01:59,  1.30it/s]Processing boreholes:  32%|███▏      | 74/228 [02:05<01:52,  1.37it/s]Processing boreholes:  33%|███▎      | 75/228 [02:06<01:44,  1.47it/s]Processing boreholes:  33%|███▎      | 76/228 [02:07<01:43,  1.46it/s]Processing boreholes:  34%|███▍      | 77/228 [02:07<01:44,  1.44it/s]Processing boreholes:  34%|███▍      | 78/228 [02:08<01:43,  1.45it/s]Processing boreholes:  35%|███▍      | 79/228 [02:09<01:40,  1.49it/s]Processing boreholes:  35%|███▌      | 80/228 [02:09<01:39,  1.49it/s]Processing boreholes:  36%|███▌      | 81/228 [02:10<01:39,  1.48it/s]Processing boreholes:  36%|███▌      | 82/228 [02:11<01:36,  1.51it/s]Processing boreholes:  36%|███▋      | 83/228 [02:11<01:36,  1.51it/s]Processing boreholes:  37%|███▋      | 84/228 [02:12<01:32,  1.55it/s]Processing boreholes:  37%|███▋      | 85/228 [02:12<01:29,  1.60it/s]Processing boreholes:  38%|███▊      | 86/228 [02:13<01:46,  1.34it/s]Processing boreholes:  38%|███▊      | 87/228 [02:14<01:40,  1.40it/s]Processing boreholes:  39%|███▊      | 88/228 [02:15<01:35,  1.47it/s]Processing boreholes:  39%|███▉      | 89/228 [02:15<01:31,  1.52it/s]Processing boreholes:  39%|███▉      | 90/228 [02:16<01:27,  1.58it/s]Processing boreholes:  40%|███▉      | 91/228 [02:17<01:39,  1.38it/s]Processing boreholes:  40%|████      | 92/228 [02:18<01:46,  1.28it/s]Processing boreholes:  41%|████      | 93/228 [02:19<01:50,  1.22it/s]Processing boreholes:  41%|████      | 94/228 [02:19<01:40,  1.34it/s]Processing boreholes:  42%|████▏     | 95/228 [02:20<01:32,  1.43it/s]Processing boreholes:  42%|████▏     | 96/228 [02:21<01:54,  1.15it/s]Processing boreholes:  43%|████▎     | 97/228 [02:22<02:06,  1.04it/s]Processing boreholes:  43%|████▎     | 98/228 [02:23<02:16,  1.05s/it]Processing boreholes:  43%|████▎     | 99/228 [02:24<01:55,  1.11it/s]Processing boreholes:  44%|████▍     | 100/228 [02:25<01:41,  1.26it/s]Processing boreholes:  44%|████▍     | 101/228 [02:26<02:17,  1.08s/it]Processing boreholes:  45%|████▍     | 102/228 [02:27<02:09,  1.02s/it]Processing boreholes:  45%|████▌     | 103/228 [02:31<03:43,  1.79s/it]Processing boreholes:  46%|████▌     | 104/228 [02:31<02:54,  1.41s/it]Processing boreholes:  46%|████▌     | 105/228 [02:32<02:20,  1.14s/it]Processing boreholes:  46%|████▋     | 106/228 [02:33<02:32,  1.25s/it]Processing boreholes:  47%|████▋     | 107/228 [02:34<02:10,  1.08s/it]Processing boreholes:  47%|████▋     | 108/228 [02:35<01:54,  1.04it/s]Processing boreholes:  48%|████▊     | 109/228 [02:38<03:20,  1.69s/it]Processing boreholes:  48%|████▊     | 110/228 [02:44<05:34,  2.83s/it]Processing boreholes:  49%|████▊     | 111/228 [02:44<04:24,  2.26s/it]Processing boreholes:  49%|████▉     | 112/228 [02:46<03:47,  1.96s/it]Processing boreholes:  50%|████▉     | 113/228 [02:46<02:58,  1.55s/it]Processing boreholes:  50%|█████     | 114/228 [02:47<02:36,  1.37s/it]Processing boreholes:  50%|█████     | 115/228 [02:48<02:22,  1.26s/it]Processing boreholes:  51%|█████     | 116/228 [02:50<02:34,  1.38s/it]Processing boreholes:  51%|█████▏    | 117/228 [02:51<02:12,  1.20s/it]Processing boreholes:  52%|█████▏    | 118/228 [02:51<01:56,  1.06s/it]Processing boreholes:  52%|█████▏    | 119/228 [02:52<01:53,  1.04s/it]Processing boreholes:  53%|█████▎    | 120/228 [02:54<02:04,  1.15s/it]Processing boreholes:  53%|█████▎    | 121/228 [02:55<02:10,  1.22s/it]Processing boreholes:  54%|█████▎    | 122/228 [02:56<01:48,  1.03s/it]Processing boreholes:  54%|█████▍    | 123/228 [02:57<01:59,  1.14s/it]Processing boreholes:  54%|█████▍    | 124/228 [02:59<02:06,  1.21s/it]Processing boreholes:  55%|█████▍    | 125/228 [03:01<02:44,  1.60s/it]Processing boreholes:  55%|█████▌    | 126/228 [03:04<03:30,  2.07s/it]Processing boreholes:  56%|█████▌    | 127/228 [03:06<03:29,  2.07s/it]Processing boreholes:  56%|█████▌    | 128/228 [03:09<03:41,  2.21s/it]Processing boreholes:  57%|█████▋    | 129/228 [03:11<03:49,  2.32s/it]Processing boreholes:  57%|█████▋    | 130/228 [03:16<04:59,  3.05s/it]Processing boreholes:  57%|█████▋    | 131/228 [03:17<03:47,  2.34s/it]Processing boreholes:  58%|█████▊    | 132/228 [03:18<03:20,  2.08s/it]Processing boreholes:  58%|█████▊    | 133/228 [03:19<02:36,  1.65s/it]Processing boreholes:  59%|█████▉    | 134/228 [03:22<02:59,  1.91s/it]Processing boreholes:  59%|█████▉    | 135/228 [03:22<02:21,  1.52s/it]Processing boreholes:  60%|█████▉    | 136/228 [03:25<02:49,  1.84s/it]Processing boreholes:  60%|██████    | 137/228 [03:26<02:28,  1.63s/it]Processing boreholes:  61%|██████    | 138/228 [03:30<03:27,  2.31s/it]Processing boreholes:  61%|██████    | 139/228 [03:32<03:34,  2.41s/it]Processing boreholes:  61%|██████▏   | 140/228 [03:34<03:11,  2.18s/it]Processing boreholes:  62%|██████▏   | 141/228 [03:36<02:52,  1.99s/it]Processing boreholes:  62%|██████▏   | 142/228 [03:38<03:06,  2.17s/it]Processing boreholes:  63%|██████▎   | 143/228 [03:41<03:12,  2.26s/it]Processing boreholes:  63%|██████▎   | 144/228 [03:41<02:30,  1.79s/it]Processing boreholes:  64%|██████▎   | 145/228 [03:43<02:19,  1.68s/it]Processing boreholes:  64%|██████▍   | 146/228 [03:44<02:13,  1.63s/it]Processing boreholes:  64%|██████▍   | 147/228 [03:46<02:12,  1.64s/it]Processing boreholes:  65%|██████▍   | 148/228 [03:47<02:09,  1.61s/it]Processing boreholes:  65%|██████▌   | 149/228 [03:49<02:00,  1.52s/it]Processing boreholes:  66%|██████▌   | 150/228 [03:49<01:36,  1.24s/it]Processing boreholes:  66%|██████▌   | 151/228 [03:51<01:37,  1.27s/it]Processing boreholes:  67%|██████▋   | 152/228 [03:53<01:49,  1.44s/it]Processing boreholes:  67%|██████▋   | 153/228 [03:54<01:55,  1.54s/it]Processing boreholes:  68%|██████▊   | 154/228 [03:56<01:59,  1.62s/it]Processing boreholes:  68%|██████▊   | 155/228 [03:58<02:04,  1.70s/it]Processing boreholes:  68%|██████▊   | 156/228 [04:00<02:08,  1.79s/it]Processing boreholes:  69%|██████▉   | 157/228 [04:02<02:02,  1.72s/it]Processing boreholes:  69%|██████▉   | 158/228 [04:02<01:41,  1.45s/it]Processing boreholes:  70%|██████▉   | 159/228 [04:04<01:46,  1.54s/it]Processing boreholes:  70%|███████   | 160/228 [04:07<02:10,  1.92s/it]Processing boreholes:  71%|███████   | 161/228 [04:08<01:43,  1.55s/it]Processing boreholes:  71%|███████   | 162/228 [04:08<01:22,  1.26s/it]Processing boreholes:  71%|███████▏  | 163/228 [04:09<01:08,  1.05s/it]Processing boreholes:  72%|███████▏  | 164/228 [04:09<00:58,  1.10it/s]Processing boreholes:  72%|███████▏  | 165/228 [04:11<01:08,  1.08s/it]Processing boreholes:  73%|███████▎  | 166/228 [04:13<01:32,  1.49s/it]Processing boreholes:  73%|███████▎  | 167/228 [04:15<01:36,  1.59s/it]Processing boreholes:  74%|███████▎  | 168/228 [04:18<01:59,  2.00s/it]Processing boreholes:  74%|███████▍  | 169/228 [04:21<02:08,  2.17s/it]Processing boreholes:  75%|███████▍  | 170/228 [04:22<01:59,  2.05s/it]Processing boreholes:  75%|███████▌  | 171/228 [04:23<01:32,  1.63s/it]Processing boreholes:  75%|███████▌  | 172/228 [04:25<01:35,  1.70s/it]Processing boreholes:  76%|███████▌  | 173/228 [04:27<01:42,  1.86s/it]Processing boreholes:  76%|███████▋  | 174/228 [04:28<01:28,  1.63s/it]Processing boreholes:  77%|███████▋  | 175/228 [04:33<02:07,  2.41s/it]Processing boreholes:  77%|███████▋  | 176/228 [04:34<01:50,  2.12s/it]Processing boreholes:  78%|███████▊  | 177/228 [04:35<01:33,  1.83s/it]Processing boreholes:  78%|███████▊  | 178/228 [04:36<01:20,  1.62s/it]Processing boreholes:  79%|███████▊  | 179/228 [04:37<01:12,  1.48s/it]Processing boreholes:  79%|███████▉  | 180/228 [04:38<01:04,  1.34s/it]Processing boreholes:  79%|███████▉  | 181/228 [04:43<01:50,  2.35s/it]Processing boreholes:  80%|███████▉  | 182/228 [04:47<02:04,  2.70s/it]Processing boreholes:  80%|████████  | 183/228 [04:47<01:32,  2.06s/it]Processing boreholes:  81%|████████  | 184/228 [04:48<01:12,  1.66s/it]Processing boreholes:  81%|████████  | 185/228 [04:48<00:57,  1.33s/it]Processing boreholes:  82%|████████▏ | 186/228 [04:50<01:02,  1.49s/it]Processing boreholes:  82%|████████▏ | 187/228 [04:52<01:07,  1.64s/it]Processing boreholes:  82%|████████▏ | 188/228 [04:55<01:12,  1.81s/it]Processing boreholes:  83%|████████▎ | 189/228 [04:56<01:10,  1.82s/it]Processing boreholes:  83%|████████▎ | 190/228 [04:57<00:56,  1.48s/it]Processing boreholes:  84%|████████▍ | 191/228 [04:59<01:03,  1.72s/it]Processing boreholes:  84%|████████▍ | 192/228 [05:01<01:02,  1.75s/it]Processing boreholes:  85%|████████▍ | 193/228 [05:03<01:02,  1.79s/it]Processing boreholes:  85%|████████▌ | 194/228 [05:05<01:04,  1.89s/it]Processing boreholes:  86%|████████▌ | 195/228 [05:07<01:03,  1.92s/it]Processing boreholes:  86%|████████▌ | 196/228 [05:09<01:01,  1.91s/it]Processing boreholes:  86%|████████▋ | 197/228 [05:11<00:59,  1.92s/it]Processing boreholes:  87%|████████▋ | 198/228 [05:13<00:58,  1.96s/it]Processing boreholes:  87%|████████▋ | 199/228 [05:15<00:57,  1.98s/it]Processing boreholes:  88%|████████▊ | 200/228 [05:17<00:55,  1.97s/it]Processing boreholes:  88%|████████▊ | 201/228 [05:19<00:52,  1.94s/it]Processing boreholes:  89%|████████▊ | 202/228 [05:20<00:47,  1.84s/it]Processing boreholes:  89%|████████▉ | 203/228 [05:22<00:44,  1.78s/it]Processing boreholes:  89%|████████▉ | 204/228 [05:24<00:40,  1.70s/it]Processing boreholes:  90%|████████▉ | 205/228 [05:25<00:37,  1.63s/it]Processing boreholes:  90%|█████████ | 206/228 [05:27<00:38,  1.75s/it]Processing boreholes:  91%|█████████ | 207/228 [05:29<00:38,  1.81s/it]Processing boreholes:  91%|█████████ | 208/228 [05:31<00:37,  1.86s/it]Processing boreholes:  92%|█████████▏| 209/228 [05:32<00:28,  1.48s/it]Processing boreholes:  92%|█████████▏| 210/228 [05:34<00:29,  1.61s/it]Processing boreholes:  93%|█████████▎| 211/228 [05:35<00:27,  1.62s/it]Processing boreholes:  93%|█████████▎| 212/228 [05:38<00:29,  1.83s/it]Processing boreholes:  93%|█████████▎| 213/228 [05:39<00:24,  1.62s/it]Processing boreholes:  94%|█████████▍| 214/228 [05:40<00:22,  1.58s/it]Processing boreholes:  94%|█████████▍| 215/228 [05:42<00:19,  1.54s/it]Processing boreholes:  95%|█████████▍| 216/228 [05:43<00:16,  1.36s/it]Processing boreholes:  95%|█████████▌| 217/228 [05:43<00:12,  1.13s/it]Processing boreholes:  96%|█████████▌| 218/228 [05:45<00:12,  1.26s/it]Processing boreholes:  96%|█████████▌| 219/228 [05:45<00:09,  1.08s/it]Processing boreholes:  96%|█████████▋| 220/228 [05:48<00:12,  1.57s/it]Processing boreholes:  97%|█████████▋| 221/228 [05:51<00:14,  2.01s/it]Processing boreholes:  97%|█████████▋| 222/228 [05:52<00:09,  1.58s/it]Processing boreholes:  98%|█████████▊| 223/228 [05:53<00:06,  1.37s/it]Processing boreholes:  98%|█████████▊| 224/228 [05:53<00:04,  1.24s/it]Processing boreholes:  99%|█████████▊| 225/228 [05:54<00:03,  1.04s/it]Processing boreholes:  99%|█████████▉| 226/228 [05:55<00:01,  1.06it/s]Processing boreholes: 100%|█████████▉| 227/228 [05:57<00:01,  1.33s/it]Processing boreholes: 100%|██████████| 228/228 [05:59<00:00,  1.60s/it]Processing boreholes: 100%|██████████| 228/228 [05:59<00:00,  1.58s/it]

✓ Created 163,617 samples from 228 boreholes

Predicting RGB values...
✓ RGB predicted and clipped to [0, 255]

Combining real + predicted RGB datasets...
✓ Combined dataset created

================================================================================
DATASET STATISTICS
================================================================================

Total samples: 395,682
Total boreholes: 523
Unique lithologies: 14

Breakdown by RGB source:
  Real RGB:       238,506 samples ( 60.3%)
  Predicted RGB:  157,176 samples ( 39.7%)

Comparison to v2.6.7:
  v2.6.7 samples:      238,506
  v2.6.10 samples:     395,682 (+66%)
  v2.6.7 boreholes:        296
  v2.6.10 boreholes:       523 (+77%)

✓ Saved to vae_training_data_v2_6_10.csv

================================================================================
NEXT STEPS
================================================================================

1. Train VAE v2.6.10 with same architecture as v2.6.7:
   - 10D latent space
   - β annealing: 1e-10 → 0.75 over 50 epochs
   - Distribution-aware scaling

2. Compare performance:
   - v2.6.7: 239K samples, 296 BH, all real RGB
   - v2.6.10: ???K samples, 525 BH, mixed real/predicted RGB

3. Expected outcomes:
   ✓ Best case: +77% boreholes improves clustering despite RGB noise
   ⚠ Moderate: Similar performance (noise cancels data gain)
   ✗ Worst case: Predicted RGB degrades performance

This is a novel approach - different from all previous failures!


Command: python3 train_vae_v2_6_10.py
